{
  "$schema": "https://json-schema.org/draft/2020-12/schema",
  "title": "SettleGraph evidence-grounded AI investigation",
  "type": "object",
  "additionalProperties": false,
  "required": [
    "summary",
    "hypotheses",
    "recommended_actions",
    "evidence_ids",
    "limitations"
  ],
  "properties": {
    "summary": {
      "type": "string"
    },
    "hypotheses": {
      "type": "array",
      "items": {
        "type": "object",
        "additionalProperties": false,
        "required": [
          "explanation",
          "evidence_ids"
        ],
        "properties": {
          "explanation": {
            "type": "string"
          },
          "evidence_ids": {
            "type": "array",
            "items": {
              "type": "string"
            }
          }
        }
      }
    },
    "recommended_actions": {
      "type": "array",
      "items": {
        "type": "string"
      }
    },
    "evidence_ids": {
      "type": "array",
      "items": {
        "type": "string"
      }
    },
    "limitations": {
      "type": "array",
      "items": {
        "type": "string"
      }
    }
  }
}
